{
  "compatibility": {
    "migration": "factory_full_erase_reflash_to_v2",
    "predecessor_map_versions": [],
    "reserved_gap_policy": "forbid",
    "unknown_map_policy": "fail_closed"
  },
  "deployment_state": "deployed_compatibility",
  "geometry": {
    "erase_size": 4096,
    "profile": "w25q128jv_16m",
    "program_size": 256,
    "total_size": 16777216,
    "xip_base": 268435456
  },
  "map_version": 1,
  "partitions": [
    {
      "alignment": 4096,
      "executable": true,
      "id": "BOOTLOADER",
      "offset": 0,
      "permissions": {
        "app": [
          "read"
        ],
        "boot": [
          "read",
          "execute"
        ],
        "factory": [
          "read",
          "write",
          "execute"
        ]
      },
      "size": 262144,
      "store_type": "image",
      "update_policy": "factory_only"
    },
    {
      "alignment": 4096,
      "executable": true,
      "id": "APP_A",
      "offset": 262144,
      "permissions": {
        "app": [
          "read",
          "write",
          "execute"
        ],
        "boot": [
          "read",
          "execute"
        ],
        "factory": [
          "read",
          "write",
          "execute"
        ]
      },
      "size": 1572864,
      "store_type": "image",
      "update_policy": "inactive_slot_only"
    },
    {
      "alignment": 4096,
      "executable": true,
      "id": "APP_B",
      "offset": 1835008,
      "permissions": {
        "app": [
          "read",
          "write",
          "execute"
        ],
        "boot": [
          "read",
          "execute"
        ],
        "factory": [
          "read",
          "write",
          "execute"
        ]
      },
      "size": 1572864,
      "store_type": "image",
      "update_policy": "inactive_slot_only"
    },
    {
      "alignment": 4096,
      "executable": false,
      "id": "BOOT_CONTROL",
      "offset": 3407872,
      "permissions": {
        "app": [
          "read",
          "write"
        ],
        "boot": [
          "read",
          "write"
        ],
        "factory": [
          "read",
          "write"
        ]
      },
      "size": 65536,
      "store_type": "boot_control",
      "update_policy": "legacy_redundant_metadata"
    },
    {
      "alignment": 4096,
      "executable": false,
      "id": "PRODUCT_NVS",
      "offset": 3473408,
      "permissions": {
        "app": [
          "read",
          "write"
        ],
        "boot": [],
        "factory": [
          "read",
          "write"
        ]
      },
      "size": 65536,
      "store_type": "nvs",
      "update_policy": "legacy_single_sector_rewrite"
    },
    {
      "alignment": 4096,
      "executable": false,
      "id": "SCRATCH",
      "offset": 3538944,
      "permissions": {
        "app": [
          "read",
          "write"
        ],
        "boot": [
          "read",
          "write"
        ],
        "factory": [
          "read",
          "write"
        ]
      },
      "size": 655360,
      "store_type": "scratch",
      "update_policy": "legacy_copy_to_active"
    },
    {
      "alignment": 4096,
      "executable": false,
      "id": "FUTURE_POOL",
      "offset": 4194304,
      "permissions": {
        "app": [],
        "boot": [],
        "factory": []
      },
      "size": 12582912,
      "store_type": "reserved",
      "update_policy": "v2_factory_migration_only"
    }
  ],
  "schema_version": 1
}
